{
  "schema_version": 1,
  "diagram_type": "sequence-er",
  "meta": {
    "title": "ヘルスチェック",
    "locale": "ja",
    "quality_profile": "showcase"
  },
  "label": "ヘルスチェック",
  "sequence": {
    "schema_version": 1,
    "diagram_type": "sequence",
    "meta": {
      "title": "外部APIのヘルスチェック",
      "locale": "ja",
      "quality_profile": "showcase",
      "column_fit": "spread",
      "viewBox": [
        1360,
        560
      ]
    },
    "participants": [
      {
        "id": "client",
        "label": "呼び出し元",
        "type": "frontend"
      },
      {
        "id": "api",
        "label": "外部API",
        "type": "external"
      }
    ],
    "messages": [
      {
        "id": "health",
        "from": "client",
        "to": "api",
        "y": 180,
        "label": "GET /health"
      },
      {
        "id": "health-result",
        "from": "api",
        "to": "client",
        "y": 280,
        "label": "200 OK",
        "variant": "return"
      }
    ]
  }
}
